[
  {
    "difficulty": "Intermediate",
    "id": "emulatorjs-selfhost",
    "sections": [
      {
        "body": "EmulatorJS is a free, open-source project that puts classic console emulation in a web page. It bundles libretro cores compiled to WebAssembly, so systems from the NES to the GBA run right in the browser with no plugins.\n\nThe software itself is completely legal — and it ships with zero games. You supply the game files, and this is the part that matters: only load ROMs you dumped from cartridges or discs you own, plus homebrew and public-domain titles. Downloading commercial ROMs you don't own is piracy, no matter how nicely the player is skinned.",
        "heading": "What it is (and the legal line)"
      },
      {
        "body": "- A web host that serves static files (any static host works), or just your own computer for local play\n- ROM files you dumped yourself — see the rip-your-own-cartridges guide\n- For some systems, a BIOS file dumped from hardware you own (GBA and PlayStation cores need one)\n- About 30 minutes",
        "heading": "What you need"
      },
      {
        "body": "Grab the latest release ZIP from the project's GitHub releases page (github.com/EmulatorJS/EmulatorJS) and unzip it into your site folder. The ZIP contains the loader, the cores, and a data directory — no installer, no build step.\n\nIf you'd rather not self-host, the project's own demo page shows the same setup; the steps below work identically on any static host.",
        "heading": "1. Get the release"
      },
      {
        "body": "Create a folder (call it `roms`) and copy in only ROMs you dumped from games you own, plus homebrew or public-domain ROMs. One subfolder per system keeps cores straight — `roms/gba/`, `roms/snes/`, and so on.\n\nName files clearly. EmulatorJS doesn't care about fancy naming schemes; it cares that the file is a valid dump.",
        "heading": "2. Add your own games"
      },
      {
        "body": "Drop this into an HTML page where you want the game to appear:\n\n<div id=\"game\"></div>\n<script>\n  EJS_player = '#game';\n  EJS_core = 'gba';                 // the core for your system\n  EJS_gameUrl = 'roms/gba/mygame.gba'; // a ROM you dumped yourself\n  EJS_pathtodata = 'data/';          // EmulatorJS data directory\n</script>\n<script src=\"data/loader.js\"></script>\n\nSwap `EJS_core` for the system you're playing (`snes`, `nes`, `gb`, `gba`, `n64`, `nds`, and more are supported). The full core list is in the project's documentation.",
        "heading": "3. Embed the player"
      },
      {
        "body": "Some cores refuse to boot without a system BIOS. Dump the BIOS from hardware you own — the same dumpers in the rip-your-own guide usually handle this — and place it where the core's documentation says to look. Never download a BIOS file; like ROMs, they're copyrighted software.",
        "heading": "4. BIOS files (dump your own)"
      },
      {
        "body": "- Gamepad support is built in; most USB and Bluetooth controllers just work\n- Save states live in the browser; export them if you switch devices\n- Netplay is available for some cores if you want online multiplayer\n- On mobile, add the page to your home screen for a near-native feel",
        "heading": "5. Extras worth knowing"
      },
      {
        "body": "EmulatorJS gives you the player, not the games. If a setup tutorial tells you to download a ROM pack, close the tab — that tutorial is pointing you at piracy. Your library should be: dumps of games you physically own, homebrew from its authors, and public-domain releases. That's the whole legal lane, and it's plenty.",
        "heading": "The rule, one more time"
      }
    ],
    "slug": "emulatorjs-self-hosting",
    "summary": "Host the open-source EmulatorJS player on your own site and play ROMs you dumped yourself — setup, cores, BIOS, and the legal line.",
    "time_minutes": 30,
    "title": "EmulatorJS self-hosting guide"
  },
  {
    "difficulty": "Beginner",
    "id": "retroarch-setup",
    "sections": [
      {
        "body": "RetroArch is a free, open-source frontend for emulators. Instead of one emulator per system, you install RetroArch once and add small emulator modules called cores — one for each console you want to play. It runs on Windows, macOS, Linux, Android, iOS, and even in a browser.\n\nRetroArch contains no games and no BIOS files. You bring those: dumps of games you own (see the rip-your-own guide) and homebrew or public-domain titles.",
        "heading": "What it is (and the legal line)"
      },
      {
        "body": "Download RetroArch from retroarch.com — pick your platform. It's also on Steam and most package managers, which handle updates for you. Install it like any normal app; the first launch walks you through the basics.",
        "heading": "1. Install RetroArch"
      },
      {
        "body": "Go to Main Menu → Online Updater → Core Downloader. You'll see a list of cores, each named for the hardware it emulates. Install the core matching hardware you own — for example, a Game Boy Advance core if you have GBA cartridges to dump.\n\nCores are emulator software, and they're legal. Installing ten cores you never use harms nothing; loading a game you don't own into one is the part that's piracy.",
        "heading": "2. Download cores (the emulators)"
      },
      {
        "body": "Main Menu → Load Content → browse to your dumped ROM file. RetroArch will ask which core to use; pick the one you installed. To build a pretty library view, use Import Content → Scan Directory on a folder of your dumps — RetroArch matches them against its database and builds per-system playlists with box art.",
        "heading": "3. Load your own games"
      },
      {
        "body": "Settings → Input. Most USB and Bluetooth gamepads are recognized automatically with sane default mappings — plug in and play. If a button feels wrong, remap it per-core under Quick Menu → Controls while a game is running; RetroArch saves the remap for that core.",
        "heading": "4. Controllers"
      },
      {
        "body": "- Save states: Quick Menu → Save State, with slots per game\n- Rewind: enable it in Settings → Frame Throttle, then hold the rewind hotkey to scrub mistakes away\n- Shaders: Quick Menu → Shaders adds CRT scanlines and other retro looks\n- Netplay: Netplay menu for online multiplayer on supported cores\n- Achievements: sign up at retroachievements.org and link it in Settings for retro achievements",
        "heading": "5. The good stuff: saves, shaders, netplay"
      },
      {
        "body": "Keep your library to three sources: dumps of games you own, homebrew from its authors, and public-domain releases. RetroArch never asks where your files came from — that's your responsibility, and it's the whole difference between a legal retro setup and a piracy box.",
        "heading": "The rule, one more time"
      }
    ],
    "slug": "retroarch-setup",
    "summary": "Install RetroArch, add cores for hardware you own, and load your own dumped games — controllers, save states, shaders, and netplay included.",
    "time_minutes": 20,
    "title": "RetroArch setup guide"
  },
  {
    "difficulty": "Advanced",
    "id": "gba-wasm-recompiler",
    "sections": [
      {
        "body": "Most browser emulation interprets a console's CPU in real time. A static recompiler takes a different path: it translates the game's ARM/Thumb machine code into WebAssembly ahead of time, once. The result is a self-contained web page — WASM plus a small runtime shim — that plays the game with no emulator needed at runtime.\n\nThe open-source demo at agnt-gg/gba-pokemon-rom-to-wasm walks the whole pattern end to end and is the best reference for how the pieces fit.",
        "heading": "The pattern"
      },
      {
        "body": "The input ROM must be a dump of a cartridge you physically own — see the rip-your-own-cartridges guide. Two hard rules:\n\n1. Never feed a downloaded ROM into the toolchain. The recompiler doesn't care where the file came from; the law does.\n2. Don't redistribute the built page. The output still contains the original game's copyrighted code, so sharing the build is sharing the game.\n\nBuild for yourself, play it yourself. That's the legal lane.",
        "heading": "The non-negotiable input rule"
      },
      {
        "body": "Use a cartridge dumper — a GB Operator, Joey Jr., Sanni Cart Reader, or similar — to read your own GBA cartridge into a ROM file on your computer. Verify the dump (most dumper software shows a checksum) before you build.",
        "heading": "1. Dump your own cartridge"
      },
      {
        "body": "Clone the recompiler repository and follow its README for the toolchain install. Point the build script at your dumped ROM file. The build emits three things: a WASM module with your game's translated code, the JavaScript glue and runtime shim (this implements the GBA's graphics, sound, and timer hardware), and an HTML shell that loads it all.",
        "heading": "2. Run the recompiler on your dump"
      },
      {
        "body": "The output is static files, so any static web host works — or just open the HTML file locally. Saves typically persist via localStorage or IndexedDB in the browser. Keep the page private, or share it only with people who own the same cartridge.",
        "heading": "3. Host the build yourself"
      },
      {
        "body": "At build time, each ARM instruction in the game maps to equivalent WebAssembly operations. Anything the game expects from real GBA hardware — the picture processing unit, the sound channels, the timers, the memory-mapped I/O — is implemented in the runtime shim the recompiler ships with. It's emulation, just done ahead of time instead of on the fly.",
        "heading": "How it works, briefly"
      },
      {